{
  "$schema": "https://json-schema.org/draft/2020-12/schema",
  "$id": "progress.schema.json",
  "title": "classroom50 progress data",
  "description": "Collection data for one classroom, generated by scripts/generate_progress.py and committed by the publish workflow. Lives at <classroom>/data/progress.json. Not edited by hand.",
  "type": "object",
  "required": ["schema", "classroom", "generated_at", "assignments", "students", "cells"],
  "additionalProperties": false,
  "properties": {
    "schema": { "const": "nsu-syspro/progress/v1" },
    "classroom": { "type": "string" },
    "classroom_title": { "type": "string" },
    "generated_at": {
      "type": "string",
      "format": "date-time",
      "description": "When this snapshot was generated (UTC). Ignored by content-change detection."
    },
    "assignments": {
      "type": "array",
      "items": {
        "type": "object",
        "required": ["slug", "name", "due", "max_score", "submitted"],
        "additionalProperties": false,
        "properties": {
          "slug": { "type": "string" },
          "name": { "type": "string" },
          "due": { "type": ["string", "null"], "format": "date-time" },
          "max_score": { "type": "integer", "minimum": 0 },
          "collected_at": {
            "type": ["string", "null"],
            "format": "date-time",
            "description": "When scores for this assignment were last collected. Ignored by content-change detection."
          },
          "submitted": { "type": "integer", "minimum": 0 }
        }
      }
    },
    "students": {
      "type": "array",
      "items": {
        "type": "object",
        "required": ["username", "display"],
        "additionalProperties": false,
        "properties": {
          "username": { "type": "string" },
          "display": { "type": "string", "description": "Full name from the roster, or the username as fallback." }
        }
      }
    },
    "cells": {
      "type": "array",
      "description": "One entry per (student, assignment) with at least one collected submission.",
      "items": {
        "type": "object",
        "required": ["student", "assignment", "score", "max_score", "review", "pr_url"],
        "additionalProperties": false,
        "properties": {
          "student": { "type": "string" },
          "assignment": { "type": "string" },
          "score": { "type": ["integer", "null"], "minimum": 0 },
          "max_score": { "type": "integer", "minimum": 0 },
          "review": {
            "enum": ["approved", "changes_requested", "unreviewed", "no_pr", "unknown"]
          },
          "pr_url": { "type": "string", "format": "uri" },
          "release_url": { "type": "string", "format": "uri" }
        }
      }
    }
  }
}
