{
 "schema": "nsu-syspro/progress/v1",
 "classroom": "mpt",
 "classroom_title": "Modern Programmer's Tools",
 "generated_at": "2026-09-29T02:48:58Z",
 "assignments": [
  {
   "slug": "command-line-basics",
   "name": "Command-line basics",
   "due": "2026-09-11T16:59:00Z",
   "max_score": 10,
   "collected_at": "2026-09-28T20:15:16Z",
   "submitted": 17
  },
  {
   "slug": "regex-basics",
   "name": "Regex basics",
   "due": "2026-09-18T16:59:00Z",
   "max_score": 10,
   "collected_at": "2026-09-28T20:15:16Z",
   "submitted": 17
  },
  {
   "slug": "encoding-basics",
   "name": "Encoding basics",
   "due": "2026-09-25T16:59:00Z",
   "max_score": 10,
   "collected_at": "2026-09-28T20:15:16Z",
   "submitted": 17
  },
  {
   "slug": "bash-basics",
   "name": "Bash basics",
   "due": "2026-10-02T16:59:00Z",
   "max_score": 10,
   "collected_at": "2026-09-28T20:15:16Z",
   "submitted": 2
  },
  {
   "slug": "git-basics",
   "name": "Git basics",
   "due": "2026-10-09T16:59:00Z",
   "max_score": 10,
   "collected_at": "2026-09-28T20:15:16Z",
   "submitted": 1
  },
  {
   "slug": "markup-basics",
   "name": "Markup basics",
   "due": "2026-10-23T16:59:00Z",
   "max_score": 10,
   "collected_at": "2026-09-28T20:15:16Z",
   "submitted": 1
  }
 ],
 "students": [
  {
   "username": "The-Durian-art",
   "display": "Дэннис Андреевич Артес"
  },
  {
   "username": "Semex37",
   "display": "Семён Максимович Голоколос"
  },
  {
   "username": "mrygrz8",
   "display": "Мария Игоревна Грозная"
  },
  {
   "username": "Liondwap",
   "display": "Лев Антонович Данилов"
  },
  {
   "username": "semka39",
   "display": "Семён Владимирович Дружинин"
  },
  {
   "username": "vladimir212455",
   "display": "Владимир Юрьевич Мазный"
  },
  {
   "username": "reznya213",
   "display": "Глеб Георгиевич Мирошников"
  },
  {
   "username": "catinhat01",
   "display": "Илья Павлович Обогрелов"
  },
  {
   "username": "dominik-DeKoko",
   "display": "Кирилл Васильевич Пуртов"
  },
  {
   "username": "KycokXleba",
   "display": "Михаил Александрович Санжаров"
  },
  {
   "username": "Aokdi",
   "display": "Святослав Вячеславович Стыпник"
  },
  {
   "username": "Lavandamosh",
   "display": "Илья Олегович Фадеенко"
  },
  {
   "username": "vebeta",
   "display": "Владислав Александрович Хегай"
  },
  {
   "username": "FunnyGlupik",
   "display": "Григорий Викторович Чепурченко"
  },
  {
   "username": "Bimbusick",
   "display": "Кирилл Игоревич Шелепов"
  },
  {
   "username": "grommoott",
   "display": "Григорий Алексеевич Шуваев"
  },
  {
   "username": "vikxxie",
   "display": "vikxxie"
  }
 ],
 "cells": [
  {
   "student": "vladimir212455",
   "assignment": "bash-basics",
   "score": 10,
   "max_score": 10,
   "review": "unreviewed",
   "pr_url": "https://github.com/nsu-syspro/mpt-bash-basics-vladimir212455/pull/1",
   "release_url": "https://github.com/nsu-syspro/mpt-bash-basics-vladimir212455/releases/tag/submit%2F2026-09-25T13-06-19Z-473c677"
  },
  {
   "student": "Semex37",
   "assignment": "bash-basics",
   "score": 10,
   "max_score": 10,
   "review": "unreviewed",
   "pr_url": "https://github.com/nsu-syspro/mpt-bash-basics-Semex37/pull/1",
   "release_url": "https://github.com/nsu-syspro/mpt-bash-basics-semex37/releases/tag/submit%2F2026-09-26T16-04-49Z-a681029"
  },
  {
   "student": "KycokXleba",
   "assignment": "command-line-basics",
   "score": 10,
   "max_score": 10,
   "review": "approved",
   "pr_url": "https://github.com/nsu-syspro/mpt-command-line-basics-KycokXleba/pull/1",
   "release_url": "https://github.com/nsu-syspro/mpt-command-line-basics-kycokxleba/releases/tag/submit%2F2026-09-09T12-18-46Z-a950967"
  },
  {
   "student": "semka39",
   "assignment": "command-line-basics",
   "score": 10,
   "max_score": 10,
   "review": "approved",
   "pr_url": "https://github.com/nsu-syspro/mpt-command-line-basics-semka39/pull/1",
   "release_url": "https://github.com/nsu-syspro/mpt-command-line-basics-semka39/releases/tag/submit%2F2026-09-09T15-56-10Z-78b92d4"
  },
  {
   "student": "grommoott",
   "assignment": "command-line-basics",
   "score": 10,
   "max_score": 10,
   "review": "approved",
   "pr_url": "https://github.com/nsu-syspro/mpt-command-line-basics-grommoott/pull/1",
   "release_url": "https://github.com/nsu-syspro/mpt-command-line-basics-grommoott/releases/tag/submit%2F2026-09-05T14-08-50Z-a1b9efe"
  },
  {
   "student": "vladimir212455",
   "assignment": "command-line-basics",
   "score": 10,
   "max_score": 10,
   "review": "approved",
   "pr_url": "https://github.com/nsu-syspro/mpt-command-line-basics-vladimir212455/pull/1",
   "release_url": "https://github.com/nsu-syspro/mpt-command-line-basics-vladimir212455/releases/tag/submit%2F2026-09-04T12-21-40Z-db3d04d"
  },
  {
   "student": "Liondwap",
   "assignment": "command-line-basics",
   "score": 10,
   "max_score": 10,
   "review": "approved",
   "pr_url": "https://github.com/nsu-syspro/mpt-command-line-basics-Liondwap/pull/1",
   "release_url": "https://github.com/nsu-syspro/mpt-command-line-basics-liondwap/releases/tag/submit%2F2026-09-05T11-28-42Z-9c54c47"
  },
  {
   "student": "The-Durian-art",
   "assignment": "command-line-basics",
   "score": 10,
   "max_score": 10,
   "review": "approved",
   "pr_url": "https://github.com/nsu-syspro/mpt-command-line-basics-The-Durian-art/pull/1",
   "release_url": "https://github.com/nsu-syspro/mpt-command-line-basics-the-durian-art/releases/tag/submit%2F2026-09-09T14-52-52Z-e0a7914"
  },
  {
   "student": "vikxxie",
   "assignment": "command-line-basics",
   "score": 10,
   "max_score": 10,
   "review": "approved",
   "pr_url": "https://github.com/nsu-syspro/mpt-command-line-basics-vikxxie/pull/1",
   "release_url": "https://github.com/nsu-syspro/mpt-command-line-basics-vikxxie/releases/tag/submit%2F2026-09-10T13-47-50Z-40454d1"
  },
  {
   "student": "mrygrz8",
   "assignment": "command-line-basics",
   "score": 10,
   "max_score": 10,
   "review": "approved",
   "pr_url": "https://github.com/nsu-syspro/mpt-command-line-basics-mrygrz8/pull/1",
   "release_url": "https://github.com/nsu-syspro/mpt-command-line-basics-mrygrz8/releases/tag/submit%2F2026-09-06T07-33-37Z-134e961"
  },
  {
   "student": "reznya213",
   "assignment": "command-line-basics",
   "score": 10,
   "max_score": 10,
   "review": "approved",
   "pr_url": "https://github.com/nsu-syspro/mpt-command-line-basics-reznya213/pull/1",
   "release_url": "https://github.com/nsu-syspro/mpt-command-line-basics-reznya213/releases/tag/submit%2F2026-09-09T17-37-32Z-4b7e426"
  },
  {
   "student": "Semex37",
   "assignment": "command-line-basics",
   "score": 10,
   "max_score": 10,
   "review": "approved",
   "pr_url": "https://github.com/nsu-syspro/mpt-command-line-basics-Semex37/pull/1",
   "release_url": "https://github.com/nsu-syspro/mpt-command-line-basics-semex37/releases/tag/submit%2F2026-09-07T16-39-18Z-9582218"
  },
  {
   "student": "catinhat01",
   "assignment": "command-line-basics",
   "score": 10,
   "max_score": 10,
   "review": "approved",
   "pr_url": "https://github.com/nsu-syspro/mpt-command-line-basics-catinhat01/pull/1",
   "release_url": "https://github.com/nsu-syspro/mpt-command-line-basics-catinhat01/releases/tag/submit%2F2026-09-07T16-11-09Z-8475680"
  },
  {
   "student": "dominik-DeKoko",
   "assignment": "command-line-basics",
   "score": 10,
   "max_score": 10,
   "review": "approved",
   "pr_url": "https://github.com/nsu-syspro/mpt-command-line-basics-dominik-DeKoko/pull/1",
   "release_url": "https://github.com/nsu-syspro/mpt-command-line-basics-dominik-dekoko/releases/tag/submit%2F2026-09-11T14-03-55Z-b838b8a"
  },
  {
   "student": "Lavandamosh",
   "assignment": "command-line-basics",
   "score": 10,
   "max_score": 10,
   "review": "approved",
   "pr_url": "https://github.com/nsu-syspro/mpt-command-line-basics-Lavandamosh/pull/1",
   "release_url": "https://github.com/nsu-syspro/mpt-command-line-basics-lavandamosh/releases/tag/submit%2F2026-09-10T16-41-30Z-f22889c"
  },
  {
   "student": "Bimbusick",
   "assignment": "command-line-basics",
   "score": 10,
   "max_score": 10,
   "review": "approved",
   "pr_url": "https://github.com/nsu-syspro/mpt-command-line-basics-Bimbusick/pull/1",
   "release_url": "https://github.com/nsu-syspro/mpt-command-line-basics-bimbusick/releases/tag/submit%2F2026-09-11T02-45-42Z-cf0d748"
  },
  {
   "student": "Aokdi",
   "assignment": "command-line-basics",
   "score": 10,
   "max_score": 10,
   "review": "approved",
   "pr_url": "https://github.com/nsu-syspro/mpt-command-line-basics-Aokdi/pull/1",
   "release_url": "https://github.com/nsu-syspro/mpt-command-line-basics-aokdi/releases/tag/submit%2F2026-09-11T16-49-01Z-7660a38"
  },
  {
   "student": "FunnyGlupik",
   "assignment": "command-line-basics",
   "score": 10,
   "max_score": 10,
   "review": "approved",
   "pr_url": "https://github.com/nsu-syspro/mpt-command-line-basics-FunnyGlupik/pull/1",
   "release_url": "https://github.com/nsu-syspro/mpt-command-line-basics-funnyglupik/releases/tag/submit%2F2026-09-11T16-54-41Z-26a2f9a"
  },
  {
   "student": "vebeta",
   "assignment": "command-line-basics",
   "score": 10,
   "max_score": 10,
   "review": "approved",
   "pr_url": "https://github.com/nsu-syspro/mpt-command-line-basics-vebeta/pull/1",
   "release_url": "https://github.com/nsu-syspro/mpt-command-line-basics-vebeta/releases/tag/submit%2F2026-09-12T07-13-07Z-42a6acc"
  },
  {
   "student": "KycokXleba",
   "assignment": "encoding-basics",
   "score": 10,
   "max_score": 10,
   "review": "unreviewed",
   "pr_url": "https://github.com/nsu-syspro/mpt-encoding-basics-KycokXleba/pull/1",
   "release_url": "https://github.com/nsu-syspro/mpt-encoding-basics-kycokxleba/releases/tag/submit%2F2026-09-24T18-39-07Z-99f8760"
  },
  {
   "student": "semka39",
   "assignment": "encoding-basics",
   "score": 10,
   "max_score": 10,
   "review": "unreviewed",
   "pr_url": "https://github.com/nsu-syspro/mpt-encoding-basics-semka39/pull/1",